ASIN,TitleB077NBZLLN,BARbee Japanese Chirimen & Kimono Print Goldfish Drawstring Pouch Coin Purse Cosmetic Jewelry Key Bag
B013J6YVXS,"3"" x 4"" Black Velveteen Sack Pouch Bags for Jewelry, Gifts, Event Supplies (50 Pouches)"
B07L8NRBFY,Mythrojan Drawstring Belt Pouch Renaissance Costume Accessories Jewelry Pouch
B077K6WPB6,"RUTICH Pack of 25 Mixed Colors Large 6.75"" X 4.75"" Pouch Bags - Elegant Velvet Drawstring Bags Jewelry Pouches for Jewelry, Gifts, Event Supplies (White Red Gray Pink Blue)"
B076RHR8ZH,"Leather Drawstring Pouch, Coin Bag, Medicine Tobacco Pouch Medieval Reenactment, Size 8.5 x 6 - Made in U.S.A. by Nabob Leather (Brown, Large)"
B01DN2B10E,Dungeons & Dragons Mimic Gamer Pouch
B016IMY1TO,"Elesa Miracle 24pcs Silk Brocade Jewelry Pouch Bag, Drawstring Coin Purse, Gift Bag Value Set"
B07RGDKSDF,"Sansam 48pcs 12 Colors Mixed Drawstrings Velvet Gift Bags Jewelry Pouches for Wedding Favors, Candy Bags, Party Favors, 4.0x4.8''"
B08BNX782Y,"8 Pieces Velvet Tarot Rune Bag Velvet Drawstring Bag Tarot Bag Bundle 6 x 9 Inch Velvet Pouch Jewelry Bags, Moss Green, Royal Blue, Purple, Wine Red, Rose, Black"
B07QJGHJVG,Mythrojan Medieval Renaissance Suede Jewelry Belt Pouch LARP Costume Waist Bag
B07QBJMPZ1,Mythrojan Suede Drawstring Pouches LARP Suede Medieval Trinket Bag set of 2
